{
  "$schema": "http://json-schema.org/draft-07/schema#",
  "version": "1.0.0",
  "description": "Canonical Storylines for the Universal Brand System",
  "source_section": "SECTION_CANON_THESIXSTORYLINES",
  "storylines": [
    {
      "id": "STORY_HIDDEN_CAUSE",
      "name": "The Hidden Cause",
      "structure": "Name the pain, reveal the overlooked mechanism, show proof."
    },
    {
      "id": "STORY_QUIET_FIX",
      "name": "The Quiet Fix",
      "structure": "Contrast loud claims with calm evidence, then offer the fix."
    },
    {
      "id": "STORY_FIRST_MORNING",
      "name": "The First Morning",
      "structure": "Describe the first pain-free step, then explain how it is achieved."
    },
    {
      "id": "STORY_RETURN_TO_WORK",
      "name": "The Return to Work",
      "structure": "Show fatigue, remove fear, restore endurance."
    },
    {
      "id": "STORY_SKEPTIC_BELIEVER",
      "name": "The Skeptic Turned Believer",
      "structure": "Founder doubt, test, proof, conversion."
    },
    {
      "id": "STORY_CLINIC_STANDARD",
      "name": "The Clinic Standard",
      "structure": "Borrow clinical rituals to increase trust."
    }
  ]
}
